{
  "slug": "rocinante-x-12b", "family": "mistral-nemo", "kind": "dense",
  "n_layers": 40, "full_attn_layers": 40, "kv_heads": 8, "head_dim": 128,
  "native_ctx": 32768,
  "cache_type_policy": {"k": "q8_0", "v": "q8_0",
    "reason": "dense GQA; q8_0 halves KV with negligible quality loss"},
  "ggufs": [
    {"repo": "TheDrummer/Rocinante-X-12B-v1-GGUF", "file": "Rocinante-X-12B-v1b-Q6_K.gguf",
     "bytes": 10056212768, "quant": "Q6_K"},
    {"repo": "TheDrummer/Rocinante-X-12B-v1-GGUF", "file": "Rocinante-X-12B-v1b-Q5_K_M.gguf",
     "bytes": 8727634208, "quant": "Q5_K_M"},
    {"repo": "TheDrummer/Rocinante-X-12B-v1-GGUF", "file": "Rocinante-X-12B-v1b-Q4_K_M.gguf",
     "bytes": 7477207328, "quant": "Q4_K_M"}
  ],
  "license": "apache-2.0", "use_cases": ["creative"],
  "sources": ["https://huggingface.co/TheDrummer/Rocinante-X-12B-v1",
              "https://huggingface.co/TheDrummer/Rocinante-X-12B-v1-GGUF"]
}
